Record;Event;Author;Recipient/dedicatee information;Recipient/dedicatee;Title;Printer;Printer information;Place;Summary;Other places quoted by the printer;Year;Language;Form (prose/verses/mixed);Identifier in USTC;Reference copy-ies;Digitised copy link;Related images and documents;Additional notes;Analaytic tags;Private notes
P-1514-VA-0001;1514 Valencia Earthquake;Calvo, Pedro;;;Obra sobre el temor de Valencia;;;;;;1514;Spanish;;347315;Seville, Biblioteca Capitular y Colombina ;;;;;
P-1531-LI-0002;1531 Lisbon Earthquake;;;;Traslado de una carta que de Portugal embiaron al muy illustre señor el Marqués de Tarifa, en que le hacen relación del muy espantoso y extraño terremoto, y temerosas señales de gran admiración: que fue y se vieron en la mar, y en la tierra jueves a veynte y seys de enero deste año de treynta y uno;;;;;;1531;Spanish;Prose;339063;Madrid, Biblioteca Nacional de España V/104-28;;;Narra anche di un diluvio avvenuto a Roma nello stesso anno;;Foto Schiano
P-1531-LI-07D5;1531 Lisbon Earthquake;;Al multo illustriss. s. Marchese de Tarifa;Alcala, Pedro Afan De Ribera (Generically called Marquis of Tarifa in the frontispiece);Transonto d'una lettera che da Portugallo fu mandata al molto illustriss. s. marchese de Tarifa in la quale li fanno relatione del multo spaventoso e stranio terremoto et timorosi signali de gran admiratione che foro et se videro in Portugallo in mare e in terra. iovidi a XXVI de gennaro MDXXXI;;;;;;1531;Italian;Prose;;Parma, Biblioteca Palatina CNCE063502;https://opac.sbn.it/web/edit-16/resultset-titoli/-/titoli/detail/CNCE063502#detail-collapse-CNCE063502-0;;;;Riferimento per l'identificazione del Marchese de Tarifa: https://www.treccani.it/enciclopedia/pedro-afan-de-ribera-duca-di-alcala_%28Dizionario-Biografico%29...
P-1531-LI-0A9D;1531 Lisbon Earthquake;Borghigiani, Benedetto Maria;a Maria Vergine Madre di Dio;Virgin Mary;Intera / narrazione della Vita, Costumi, e Intelligenze Spirituali della Venerabile / Sposa di Gesù Suor Domenica dal Paradiso fondatrice del Monastero della Croce / di Firenze;Nestenus, Michele;Nella / Stamperia di Michele Nestenus all’Insegna del Nome di Gesù;Florence;In Lisbon, the damage from the 1531 earthquake also made us forget the danger of the plague.;;1719;Italian;Prose;;Florence, Biblioteca Nazionale Centrale MAGL. 2.4.19;https://books.googleusercontent.com/books/content?req=AKW5QaeHrkkSheo1idueFapDD-amkiLP0wsjR_2OlAFaYT7IjE7h8mp128KhVHk892Zemqkyac1Ht3NY0ek10NjD5spc1xdRs7gOJAJEfuDX_nBLEwIyJiANsjyAhgwa7xEGo7tL7GFmTk1xQFW0MPV63XPZM7_bQtkMcFLqaaoJn6xpLQ4qUJWMACYCCIAxD6xZFwHON;;;FORME PARTICOLARI DI RAPPRESENTAZIONE/NARRAZIONE→Enumerazione dei danni e delle vittime;
P-1536-EE-0782;1536 Etna Eruption;;;;Li horrendi, et spaventosi prodigi, et fuochi aparsi in Sicilia nel Monte de Ethna o vero Mongibello con li particolari del danno et la qualità del fuoco con altri successi nel isola;;;;;;1536;Italian;Prose;802758;"Rome, Biblioteca Angelica F.ANT XX.7 13/21; Piacenza, Biblioteca Comunale Passerini-Landi (LP)         183.13; Treviso, Biblioteca Comunale, sede di Borgo Cavour Misc.        0612.18; Venice, Biblioteca Nazionale Marciana MISC 2088.        031";;;;;Documento non recuperato. Informazioni parziali ricavate dai cataloghi delle biblioteche e degli archivi (Rosa Anna)
P-1536-EE-0A65;1536 Etna Eruption;Beatillo, Antonio;;;Historia / della vita, miracoli, traslatione e gloria dell’illustrissimo Confessore di / Christo San Nicolò il Magno Arcivescovo di Mira Patrone, e Protettore della / Città di Bari composta dal Padre Antonio Beatillo da Bari della Compagnia di / Giesù, e dall’istesso nella seconda, e terza edittione accresciuta in alcune / cose, e ridotta per tutto à maggior brevità;Pizzana, Nicolò;Per Nicolò Pizzana;Venice;During an eruption of Etna in 1537, San Nicolò saved a monastery consecrated to him from destruction.;;1705;Italian;Prose;;Madrid, Biblioteca de la Universidad Complutense de Madrid BH FLL 7605;https://books.googleusercontent.com/books/content?req=AKW5QafvkrCZJvAQOHx69TjN7m_WuHNA-BOAxmsaJQXYLjYMMXZGnqzqT2ooO0-GD7MpO7GczjnvIiLq6YfwtuIG_U8nxXEnX7ODRfUMYoHmniB6id982temu8J0FwHdIBm_nZB1jnFxe8tq-HUs1cqIq7s8ZRH7dWpFaYmwv-D6tn1nj6kST4mF1FY5PY5a-Sq7vFNTP;;;TOPOI DELLA NARRAZIONE→Miracoli, prodigi, Interventi soprannaturali;
P-1536-EE-0A67;1536 Etna Eruption;;;;;;;;;;;;;;;;;;;
P-1536-LE-07DD;1536 Genoa Earthquake;;;;"Il Gran terremoto tratto nella città di Genua il quale ha fatto ruinar case, palazzi, torre, e disperdere donne gravide, &amp; morte assai persone, e questo si dice esser stato cagione le gran baratterie, e il gran biastemare che si fa in esse Dio, e santi, &amp; la gloriosa Vergine Maria";Bellone, Antonio;;Genoa;;;1536;Italian;Prose;;Turin, Biblioteca Reale MISC.316.2;;;"Editio sine notis, but imprint information (place: Genoa; printer: Antonio Bellone; year: 1536) is documented by the SBN OPAC&nbsp;with the reference:&nbsp;O. Cartaregia, Per un censimento delle edizioni uscite dall'officina tipografica della famiglia Bellone, p. 23, n. 9 (https://opac.sbn.it/risultati-ricerca-avanzata/-/opac-adv/index/1/ITICCUCNCE021554?fieldstruct%5B1%5....";;
P-1538-MN-0003;1538 Monte Nuovo Eruption;Marchesino, Francesco;;;Copia de una lettera di Napoli che contiene li stupendi, et gran prodigii apparsi sopra a Pozzolo;Borgo, Giovanni Antonio;;Milan;Francesco Marchesino, a Milanese publisher, was among the curious observers of the sudden eruption of Mount Nuovo. He documented this natural event in a letter, subsequently printed, describing the awe-inspiring phenomena of the eruption and the fear it generated. Marchesino recounted a devotional procession culminating in the ritual beheading of Saint Gennaro in the chapel where the martyrdom occurred in the vicinity of Pozzuoli. In the following passages, the letter focused on the Viceroy's visit to the disaster-stricken areas, accompanied by philosophers who framed the event within Aristotelian theses.;;1539;Italian;Prose;802830;"Paris, Bibliothèque Mazarine 4° 14771 A-34; Munich, Bayerische Staatsbibliothek Res/4 Phys.sp. 300,16";https://opacplus.bsb-muenchen.de/title/BV001397171;I-1538-MN-0220 / 1538 Monte Nuovo Eruption / View of Monte Nuovo (This document includes);;RISPOSTE ISTITUZIONALI→Inchiesta sugli effetti del disastro;nel mio database ho questo esemplare digitalizzato Di Napoli, Alli. V. d'Ottobre. M.D.XXXVIII. : https://opacplus.bsb-muenchen.de/title/BV001397171 (Milena)
P-1538-MN-0004;1538 Monte Nuovo Eruption;Falconi, Marcantonio;All'illustrissima signora marchesa della Padula; (Marquise of Padula);Dell'incendio di Pozzuolo;Sultzbach, Giovanni;Napoli, Giovanni Sultzbach, 1539 (Si venne per Marco Antonio Passaro alli Ferri vecchi);Naples;Marco Antonio delli Falconi, a renowned scholar in classical languages, was a contemporary witness to the 1538 eruption of Monte Nuovo. His work is noteworthy for describing the panic and and flight of the people of Pozzuoli during the disaster. The text offers a detailed account of the eruption's initial hours and cites Aristotle's theories to explain seismic and volcanic activity. Falconi's work defends the peripatetic perspective on natural disasters' natural origins, contrasting with contemporary prophecies. His optimism is based on the observation that the consumption of dead birds and fish had not harmed anyone following the eruption.;;1539;Italian;Prose;828671;"Florence, Biblioteca Nazionale Centrale TARG. MISC.228.4; Naples, Biblioteca della Società Napoletana di Storia Patria SISMICA 07.E. 038";https://books.google.es/books?id=GZWcQN8cZu0C&printsec=frontcover&hl=ca&source=gbs_ge_summary_r&cad=0;"I-1538-MN-021E / 1538 Monte Nuovo Eruption / View of Monte Nuovo (This document includes); M-1538-MN-0677 / 1538 Monte Nuovo Eruption / In the 2nd vol. of his handwritten book titled 'Varii Discorsi', the fountaineer G.A. Nigrone mentions a series of disasters that struck Naples and Southern Italy in the previous centuries, including the eruption of Monte Nuovo in 1538. He states that he derived the information on this event from his father's accounts, yet his description is very similar to that published in 1539 by M.A Delli Falconi. The author challenges the idea that such events are a prelude to other disasters, but may be followed by disasters 'naturally' connected to them, such as drought and famine (This document is summarized in)";;INTERPRETAZIONE→Aristotelismo/tomismo;
P-1538-MN-0005;1538 Monte Nuovo Eruption;;;;I gran segni et terremoti tratti appresso alla città di Napoli a un luoco chiamato Puzolo la vigilia di san Michele, con piovere di solfore, et folgorar de troni, e aperture di montagne, e grandissime fiamme di fuoco, et seccatosi più di tre miglia di mare, et altre cose horribile per sette, o otto giorni continui apparse, et ancora seguitano;;;;;;1539;Italian;Prose;800721;"Paris, Bibliothèque Mazarine 4° 14771 A-33; Modena, Biblioteca Estense Universitaria A 45180 *000 000 000; London, British Library General Reference Collection DRT Digital Store 7108.c.35.";https://books.google.it/books?id=hoNmAAAAcAAJ&hl=it&pg=PP2#v=onepage&q&f=false;;;COMUNITÀ/ EFFETTI SOCIALI→Manifestazioni di devozione e pentimento;Esemplare della Biblioteca Estense Universitaria: 1 v., legato all'interno di un manoscritto: 'Cronaca del Lancillotti' (https://www.bibliomo.it/SebinaOpac/resource/i-gran-segni-et-terremoti-tratti-appresso-alla-citta-di-.... La fotoriproduzione è dell'esemplare conservato alla British Library.
P-1538-MN-0006;1538 Monte Nuovo Eruption;"Toledo, Pietro Giacomo; Pino, Giovanni Battista (Author of the preface Alli studiosi della volgar lingua')'";Al illustrissimo signor Don Piero di Toledo lo Signor Marchese di Villa Franca, Vicerè e Capitano Generale di Su. Ma. nel Regno di Napoli;Toledo, Pedro Álvarez y Zúñiga (Viceroy of Naples);Ragionamento del terremoto del nuovo monte, del aprimento di terra in Pozuolo, nel anno 1538, e dela significatione d'essi, per Piero Giacomo da Toledo;Sultzbach, Giovanni;Stampata in Nap. per Giouanni Sulztbah alemano à 22 de Genaro 1539 con gratia, e, priuilegio.;Naples;Pietro Giacomo de Toledo, a witness to the 1538 eruption, authored a work explaining the disaster and dedicated to the Viceroy. This text, presented as a dialogue between Peregrino and Suessano, used Aristotelian concepts to describe the eruption's causes and effects. The dialogue explained the eruption through a metaphor based on the workings of the human body. Toledo emphasized two origins in seismic activity, a final cause (God) and a formal cause (resulting from terrestrial movements). He also discussed subterranean winds generating earthquakes in regions without openings. Toledo's outlook for the near future was pessimistic, especially for Pozzuoli.;;1539;Italian;Prose;859264;"Los Angeles, Getty Research Institute SPECIAL COLLECTIONS QE533 .T6 1539; London, University College London STRONG ROOM JOHNSTON LAVIS 1539 T6; Lucca, Biblioteca Statale B.ta 952.12; Pisa, Biblioteca Universitaria C r. 1. 2. 1; Naples, Biblioteca della Società Napoletana di Storia Patria SISMICA 07.E. 026 (1";https://archive.org/details/ragionamentodelt00tole;"I-1538-MN-021F / 1538 Monte Nuovo Eruption / View of Monte Nuovo (This document includes); P-1538-MN-0A8D / 1538 Monte Nuovo Eruption / De Puteolani aeris natura (This document is translated in)";;INTERPRETAZIONE→Aristotelismo/tomismo;L'esemplare digitalizzato è quello conservato al Getty Research Institute. Worldcat segnala altri esemplari, ma le biblioteche citate hanno solo l'ebook: https://www.worldcat.org/it/title/1170010322.
P-1538-MN-051A;1538 Monte Nuovo Eruption;Borgia, Geronimo ;AD PAVLUM III PONTEFICEMOptimi Maximi Hieronymi Borgii Conflagratio Averni Horrenda;Farnese, Alessandro ;Incendium ad Avernvm Lacvm Horribile Pridie Cal. Octob. M.D. XXXVIII. Nocte In tempesta Exortum;Cancer, Mattia;;Naples;Girolamo Borgia wrote a Latin poem asserting that the Puteolan conflagration could not be solely explained as a natural phenomenon and openly rejected Porzio's claims. According to Borgia, this calamity should be interpreted as a divine punishment for human sins.;;1539;Latin;Verse;816392;"Paris, Muséum national d'Histoire naturelle ; Naples, Biblioteca della Società Napoletana di Storia Patria SISMICA 07.E. 029";https://www.internetculturale.it/jmms/iccuviewer/iccu.jsp?teca=MagTeca+-+ICCU&id=oai:www.internetculturale.sbn.it/Teca:20:NT0000:CNCE007133;P-1538-MN-0973 / 1538 Monte Nuovo Eruption / De conflagratione Agri Puteolani, Simonis portii (This document mentions);;INTERPRETAZIONE→Punizione per i peccati degli uomini;trascritta la carta 8 recto
P-1538-MN-0973;1538 Monte Nuovo Eruption;Porzio, Simone;"Illust. D. Petro Toledo Principi Villae franchae, Regni Neap. Proregi, &amp; militum Imperatori";Toledo, Pedro Álvarez y Zúñiga (Viceroy of Naples);De conflagratione Agri Puteolani, Simonis portii;Sultzbach, Giovanni;;Naples;Simone Porzio's essay offered an Aristotelian interpretation of natural disasters. This peripatetic view became the official account of the disaster and emphasized the role of subterranean winds, linked to celestial movements, in causing earthquakes. Despite the infrequency of eruptions and earthquakes, both were considered inherent to nature. The essay provided a general reflection on earthquake causes and then outlined the events that led to the formation of Monte Nuovo.;;1539;Latin;Verse;851025;Naples, Biblioteca della Società Napoletana di Storia Patria SISMICA 07.E. 031;;"I-1538-MN-05E7 / 1538 Monte Nuovo Eruption / View of Monte Nuovo (This document includes); M-1538-MN-0373 / 1538 Monte Nuovo Eruption / A large letter on Naples state, reference to a strange star and to Porzio's work (Very similar to); P-1538-MN-051A / 1538 Monte Nuovo Eruption / Incendium ad Avernvm Lacvm Horribile Pridie Cal. Octob. M.D. XXXVIII. Nocte In tempesta Exortum (This document is mentioned in); P-1538-MN-0983 / 1538 Monte Nuovo Eruption / De conflagratione Puteolani Agri Causae &amp; significationes Simonum Portium (Very similar to)";;INTERPRETAZIONE→Aristotelismo/tomismo;ricontrollare la relazione con l'item M-1538-MN-0373 (Milena)
P-1538-MN-0983;1538 Monte Nuovo Eruption;Porzio, Simone;Illu. D. Petro - Imperat.;Toledo, Pedro Álvarez y Zúñiga (Viceroy of Naples);"De conflagratione Puteolani Agri Causae &amp; significationes Simonum Portium";Sultzbach, Giovanni;;Naples;This text would appear to be the editio princeps of Simone Porzio's essay.Porzio's essay offered an Aristotelian interpretation of natural disasters. This peripatetic view became the official account of the disaster and emphasized the role of subterranean winds, linked to celestial movements, in causing earthquakes. Despite the infrequency of eruptions and earthquakes, both were considered inherent to nature. The essay provided a general reflection on earthquake causes and then outlined the events that led to the formation of Monte Nuovo.;;1538;Latin;Verse;;Naples, Biblioteca della Società Napoletana di Storia Patria SISMICA 07.E. 049;;"I-1538-MN-05E6 / 1538 Monte Nuovo Eruption / Scene of hell (This document includes); M-1538-MN-0373 / 1538 Monte Nuovo Eruption / A large letter on Naples state, reference to a strange star and to Porzio's work (Very similar to); P-1538-MN-0973 / 1538 Monte Nuovo Eruption / De conflagratione Agri Puteolani, Simonis portii (Very similar to)";;INTERPRETAZIONE→Aristotelismo/tomismo;ricontrollare la relazione con l'item M-1538-MN-0373 (Milena)
P-1538-MN-0A22;1538 Monte Nuovo Eruption;Sandoval, Prudencio de;Dirigida al católico rey don Felipe III deste nombre, nuestro señor;Philip III;Segunda parte de la vida y hechos del emperador Carlos Quinto máximo, fortísimo rey católico de España, y de las Indias, islas y tierrafirme del mar oceano;Cañas, Sebastián de;Valladolid, por Sebastián de Cañas, año de 1606;Valladolid;In the book XXIV that is about the events of 1538 a report of Montenuovo eruption is copied. The report is introduced this way: Feneceré los cuentos deste año de 1538 con una temerosa tempestad que sucedió en el Reino de Nápoles, el qual escriuió un Cauallero desta manera;;1606;Spanish;Prose;;Madrid, Biblioteca de la Universidad Complutense de Madrid BH FLL Res. 706;;;;COMUNITÀ/ EFFETTI SOCIALI→Manifestazioni di devozione e pentimento;
P-1538-MN-0A8D;1538 Monte Nuovo Eruption;Toledo, Pietro Giacomo;ad illustriss. principem Petrum a' Toleto marchionem Villae Franchae et in Regno Neapolitano pro Regem Petri Iacobi 'a Toleto epistola;Toledo, Pedro Álvarez y Zúñiga (Viceroy of Naples);De Puteolani aeris natura;Sultzbach, Giovanni;;Naples;This text is the Latin version of the 'Ragionamento, del terremoto, del nuouo monte' by the same author.Pietro Giacomo de Toledo, a witness to the 1538 eruption, authored a work explaining the disaster and dedicated to the Viceroy. This text, presented as a dialogue between Peregrino and Suessano, used Aristotelian concepts to describe the eruption's causes and effects. The dialogue explained the eruption through a metaphor based on the workings of the human body. Toledo emphasized two origins in seismic activity, a final cause (God) and a formal cause (resulting from terrestrial movements). He also discussed subterranean winds generating earthquakes in regions without openings. Toledo's outlook for the near future was pessimistic, especially for Pozzuoli.;;1544;Latin;Prose;859265;Naples, Biblioteca della Società Napoletana di Storia Patria SISMICA 07.E. 026 (2;;P-1538-MN-0006 / 1538 Monte Nuovo Eruption / Ragionamento del terremoto del nuovo monte, del aprimento di terra in Pozuolo, nel anno 1538, e dela significatione d'essi, per Piero Giacomo da Toledo (This document is a translation of);;INTERPRETAZIONE→Aristotelismo/tomismo;
P-1538-MN-0A93;1538 Monte Nuovo Eruption;Sanfelice, Antonio;Antonius Sanctofelicius Tiberio Buchae S.P.D.;Di Buca, Tiberio;Clio divina;Sultzbach, Giovanni;Ex officina Ioannis Sulbachii Germani;Naples;Napoli, ex officina Giovanni Sultzbach, 1541;;1541;Latin;Verse;854497;Naples, Biblioteca della Società Napoletana di Storia Patria SISMICA 06.F. 009;https://play.google.com/books/reader?id=KIINOSR-PN0C&pg=GBS.PT1&hl=it;;"Pages&nbsp;32-34";SENSORIALITÀ E MATERIALITÀ→Sensazioni uditive;"Ho dovuto eliminare l'nserimento di prova di Giancarlo Riccio per un errore nella segnalazione della biblioteca che ne possiede una copia; purtroppo non si poteva semplicemente modificare (Umberto)"
P-1538-MN-0A96;1538 Monte Nuovo Eruption;Del Nero, Francesco;;;"Lettera di noui avisi de Pezolo et delle bocche del foco nuouamente aparse apresso a Napoli, &amp; de la Pronosticatione di quello et di tutto el Successo insino a questo Giorno Adi XVI d'Ottobre M.D.XXXVIII";;;;Printed version of the contents of the letter that Francesco Del Nero, a witness to the 1538 eruption, wrote to Niccolò del Benino, giving a vivid account of the impact of the disaster. Del Nero, a Florentine businessman and relative of Machiavelli, described the transformation of the once enchanting Pozzuoli into a fiery nightmare. He also expressed his inability to comprehend the immense volume of incandescent materials ejected from the crater in just two days.Del Nero mentioned the scholarly discussions surrounding the event, acknowledging the writings of Simone Porzio and the viceroy Pedro de Toledo's response, which involved digging numerous deep pits to extinguish the fire. Del Nero's letter reflects the popular perception of the eruption during his time.Del Nero compared the eruption to a pyrotechnic display at Castel Sant'Angelo, like the one held to celebrate the marriage between Margaret, daughter of Emperor Charles V, and Ottavio Farnese in November 1538, the month after the date of the letter.;;1539;Italian;Prose;;Munich, Bayerische Staatsbibliothek Res/4 Phys.sp. 304,9;https://www.digitale-sammlungen.de/en/view/bsb00020987?page=2,3;M-1538-MN-0A98 / 1538 Monte Nuovo Eruption / Copy of the contents of the letter that Francesco Del Nero, a witness to the 1538 eruption, wrote to Niccolò del Benino, giving a vivid account of the impact of the disaster. Del Nero, a Florentine businessman and relative of Machiavelli, described the transformation of the once enchanting Pozzuoli into a fiery nightmare. He also expressed his inability to comprehend the immense volume of incandescent materials ejected from the crater in just two days.Del Nero mentioned the scholarly discussions surrounding the event, acknowledging the writings of Simone Porzio and the viceroy Pedro de Toledo's response, which involved digging numerous deep pits to extinguish the fire. Del Nero's letter reflects the popular perception of the eruption during his time.Del Nero compared the eruption to a pyrotechnic display at Castel Sant'Angelo, like the one held to celebrate the marriage between Margaret, daughter of Emperor Charles V, and Ottavio Farnese in November 1538, the month after the date of the letter. (Very similar to);"This letter has been known since 1846, through Francesco Palermo’s edition:&nbsp;Archivio Storico Italiano, IX (1846), Florence. pp. 93–96";RISPOSTE ISTITUZIONALI→Inchiesta sugli effetti del disastro;Le copie manoscritte sono in Biblioteca Nazionale Centrale, Firenze, Gino Capponi CLI, cc. 123v-127v, Archivio Segreto Vaticano, Roma, Arm. XXXII 34, cc. 135v–138r, Harry Ransom Center, Austin, Ranuzzi Family Manuscripts, Ph 12844.54, cc. 183v-185r. Chiedere a Montuori le fotoriproduzioni
P-1538-MN-0AB4;1538 Monte Nuovo Eruption;"Porzio, Simone; Rizzuti, Ortensio (Translator)";;;Trattato del fuoco apparso in li luochi de Puzolo del magnifico Simone Portio;Sultzbach, Giovanni;Napoli, Giovanni Sultzbach, 1539;Naples;Vulgar translation of the epistle of Simon Porzio.;;1539;Italian;Prose;851026;Bitonto (BA), Biblioteca comunale Eustachio Rogadeo misc. B. 83;;;The final two pages are missing.;INTERPRETAZIONE→Aristotelismo/tomismo;
P-1541-GU-0007;1541 Guatemala Earthquake;Rodríguez, Juan;;;Relación del espantable terremoto que agora nuevamente ha acontecido en las yndias en una ciudad llamada Guatimala;;;;;;1541;Spanish;Prose;349565;Madrid, Biblioteca Nacional de España R/13784;http://bdh-rd.bne.es/viewer.vm?id=0000249924&page=1;;;;
P-1541-GU-0008;1541 Guatemala Earthquake;;;;Relación cierta y verdadera sacada y trasladada de una carta que a esta ciudad de Sevilla fue embiada sobre la terrible y tempestuosa tormenta que sucedió en la cibdad de Guatimala sábado dos oras después de anochecido a diez días del mes de setiembre del año passado de mil y quinientos y quarenta y uno;;;Seville;;;1542;Spanish;Prose;344840;Los Angeles, UCLA Library SRLF F1476.G92 R45 1543a;https://ucla.on.worldcat.org/oclc/21027285;I-1541-GU-0223 / 1541 Guatemala Earthquake / City View from the Sea with a Pilgrim (This document includes);;;
P-1542-ES-069B;1542 Sicily Earthquake;;;;"Copia de una lettra che contiene li spaventosi &amp; horrendi terremoti venuti ne la isola di / Sicilia &amp; la gran rovina &amp; strage che han fatto in quella con danno grandissimo de paesani. / Questo terremoto fu adì XVII decembrio MDXLII";;;;Copy of a letter describing the ruinous and disastrous outcomes of terrible earthquakes in Sicily. The local people react by showing religious devotion.;;1542;Italian;Prose;;Venice, Biblioteca Nazionale Marciana MISC 2230.        029;;I-1542-ES-0AB5 / 1542 Sicily Earthquake / A city under siege (This document includes);"Transcription in&nbsp;CFTI5Med in&nbsp;https://storing.ingv.it/cfti/cfti5/pdf_T/003003-052400_T.pdf";COMUNITÀ/ EFFETTI SOCIALI→Manifestazioni di devozione e pentimento;
P-1542-ES-06AD;1542 Sicily Earthquake;Vita, Francesco;;;Innesto istorico della città d'Augusta negli annali de' Re di Sicilia;Gueriglio, Giovanni;Venezia, nella stamperia del Gueriglio, 1653;Venice;An unusual earthquake affected the city of Augusta and the neighbouring land of Melilli, of which the ruins of the castle destroyed by the event remain.;;1653;Italian;Prose;;;;;"Transcription of the text by CFTI5Med in&nbsp;https://storing.ingv.it/cfti/cfti5/pdf_T/003003-145174_T.pdf";TOPOI DELLA NARRAZIONE→Rovine;
P-1542-ES-06AF;1542 Sicily Earthquake;Maurolico, Francesco;Ad Serenissimum Hispaniæ Principem Carolum Philippi Regis Pontentissimi F. Avthoris Episola;;Sicanicarum rerum compendium Maurolyco abbate Siculo authore;Spira, Petruccio;Messina, impressit Petruccio Spira, 1562;Messina;At the end of November, or rather at the beginning of December, many buildings in Catania, Lentini, Licodia, Mineo, Licata and Agrigento collapsed due to a major earthquake.;;1562;Latin;Prose;841632;;;;;MEMORIA / PASSATO E PRESENTE→Cronologia dello stesso evento;
P-1542-ES-06B0;1542 Sicily Earthquake;Fazello, Tommaso;"D. Philippo Hispaniæ, Angliæ, Siciliæ &amp;c. Regi Potentissimo";Philip II;De rebus Siculis decades duae, nunc primum in lucem editae. His accessit totius operis index locupletissimus;"Carrara, Giovanni Francesco; Mayda, Giovanni Matteo";"Palermo, apud Giovanni Matteo Mayda &amp; Giovanni Francesco Carrara, 1558";Palermo;Description of the victims and the damage to religious buildings, fortresses and public structures that the earthquake caused to the various communities.;;1558;Latin;Prose;828896;;;;"Transcription of the manuscript by CFTI5Med in&nbsp;https://storing.ingv.it/cfti/cfti5/pdf_T/003003-050829_T.pdf";FORME PARTICOLARI DI RAPPRESENTAZIONE/NARRAZIONE→Enumerazione dei danni e delle vittime;
